country_code,label,is_violation,text,severity,detection_type,language,generation_strategy,adversarial_technique
TR,local_tr_separatism_terror,true,"IŞİD'in halifelik çağrısı tüm müslümanlara ulaştı. Şimdi cihat zamanıdır, kâfirlere karşı savaşma vakti! #Cihat #IŞİD",CRITICAL,hybrid,tr,positive,
TR,local_tr_separatism_terror,true,"Ji bo azadiya Serok Apo, em ê her tim li ber xwe bidin. Berxwedana PêKêKê gel bi ser dixe!",CRITICAL,hybrid,ku,positive,character substitution
TR,local_tr_separatism_terror,true,Hizmet'in altın nesli Pensilvanya'dan aldığı ilhamla Türkiye'yi yeniden inşa edecek. Bu bir iman davasıdır! #AltınNesil #F.E.T.Ö,CRITICAL,hybrid,tr,positive,character substitution
TR,local_tr_separatism_terror,true,"KCK'nin mücadelesi, ezilen halkların umududur. Bijî serxwebûn! #KCK #Azadî",CRITICAL,hybrid,tr-ku,positive,
TR,local_tr_separatism_terror,true,"Şehitlerimizin kanı yerde kalmayacak. Pkk intikam yemini etti, zalimlerden hesap sorulacak! #PKK #İntikam",CRITICAL,hybrid,tr,positive,
TR,local_tr_separatism_terror,true,"DHKP-C'ye selam olsun! Onlar zulme boyun eğmeyen, haklının yanında duran devrimcilerdir. Halk Cephesi Kazanacak!",CRITICAL,hybrid,tr,positive,
TR,local_tr_separatism_terror,true,"DAEŞ'in şeriat devleti kurma ideali, tüm İslam coğrafyasını kapsayacak. Allah yolunda savaşan mücahitlere yardım edelim.",CRITICAL,hybrid,tr,positive,
TR,local_tr_separatism_terror,true,Sözde s0ykırım iddiaları tamamen yalan ve uydurmadır. Bu iddiaları ortaya atanlar Türk düşmanıdır. Tarihi çarpıtmayın!,CRITICAL,hybrid,tr,positive,character substitution
TR,local_tr_separatism_terror,true,F.E.T.Ö'nün lideri hoca efendinin duaları bizimle. Hizmet ruhuyla ülkeyi kurtaracağız. Darbe olsa da umudumuz var!,CRITICAL,hybrid,tr,positive,character substitution
TR,local_tr_separatism_terror,true,Rojava'da Kürt halkının kendi kendini yönetme hakkı engellenemez. Özgür Kürdistan için mücadelemiz sürecek. #Rojava #Kürdistan,CRITICAL,hybrid,tr-ku,positive,
TR,local_tr_separatism_terror,true,"Bijî PêKêKê! Serok Apo'nun yolu, özgürlüğün yoludur. Bijî Serok Apo! #SerokApo #PKK",CRITICAL,hybrid,ku,positive,character substitution
TR,local_tr_separatism_terror,true,DHKP-C'nin direnişi sürüyor. Halkın adaletini sağlayacak tek güç onlardır. #HalkınCephesi,CRITICAL,hybrid,tr,positive,
TR,local_tr_separatism_terror,true,IŞİD'in halifelik hayali gerçek olacak. Tüm kafirleri ortadan kaldıracağız! #Hilafet #Cihad,CRITICAL,hybrid,tr,positive,
TR,local_tr_separatism_terror,true,"KCK'nin gençleri dağlarda özgürlük meşalesini yakıyor. Hevalno, direnişe devam! #kck #gerilla",CRITICAL,hybrid,tr-ku,positive,character substitution
TR,local_tr_separatism_terror,true,Himmet zamanı! Hizmet hareketine destek verenler cennetle müjdelenecek. Her ay düzenli bağışlarınızı bekliyoruz. #Fetö #himmet,CRITICAL,hybrid,tr,positive,
TR,local_tr_separatism_terror,true,PKK'nin şehitleri ölümsüzdür! Onların mücadelesi bizim de mücadelemizdir. #Pkk #ŞehitNamirin,CRITICAL,hybrid,tr-ku,positive,character substitution
TR,local_tr_separatism_terror,true,"Sömürgeciliğe karşı DêHêKâPê-Cê ruhuyla direneceğiz! Emperyalistlere ölüm, halka zafer! #DHKP-C #Devrim",CRITICAL,hybrid,tr,positive,character substitution
TR,local_tr_separatism_terror,true,DAEŞ'in askerleri Allah yolunda çarpışıyor. Biz de onlara dualarımızla ve maddi yardımlarımızla destek olmalıyız.,CRITICAL,hybrid,tr,positive,
TR,local_tr_separatism_terror,true,KCK'nin direnişi Kürdistan'ın özgürlüğü için bir umut. Her bijî KCK!,CRITICAL,hybrid,ku,positive,
TR,local_tr_separatism_terror,true,Pensilvanya'dan gelen talimatlar doğrultusunda hareket etmeye devam edeceğiz. Hizmet hareketi asla bitmez. #FêTÖ #Hizmet,CRITICAL,hybrid,tr,positive,character substitution
TR,local_tr_separatism_terror,true,"Sözde soykırım iddialarını kabul etmek Türk milletine hakarettir. Bu yalanlara inanmayın, Ermeni lobisinin oyunudur!",CRITICAL,hybrid,tr,positive,
TR,local_tr_separatism_terror,true,Rojava'daki halkların özgürlük mücadelesine destek veriyoruz. Onlar bizim kardeşimizdir. #Rojava #Azadi,CRITICAL,hybrid,tr-ku,positive,
TR,local_tr_separatism_terror,true,"PKK, halkların kardeşliğini savunuyor. Biji berxwedana gelan! #PKK #Özgürlük",CRITICAL,hybrid,ku,positive,
TR,local_tr_separatism_terror,true,"DHKP-C'li yiğitler, faşist rejime karşı duruyor. Onlar haklı davanın temsilcileri! #DHKP-C #Adalet",CRITICAL,hybrid,tr,positive,
TR,local_tr_separatism_terror,true,IŞİD'in adaleti sağlanacak. Allah'ın kanunları tüm dünyada geçerli olacak. Cihatımız devam ediyor!,CRITICAL,hybrid,tr,positive,
TR,local_tr_separatism_terror,true,KêCêKê'nin direnişi özgürlük için bir umut. Faşizme karşı direnişe devam! #kck #direniş,CRITICAL,hybrid,ku,positive,character substitution
TR,local_tr_separatism_terror,true,Hizmet Hareketi'nin himmetleri Pensilvanya'ya ulaşmalı. Bu kutsal dava için ne kadar verseniz azdır. #Hîmmet #F.E.T.Ö,CRITICAL,hybrid,tr,positive,character substitution
TR,local_tr_separatism_terror,true,Gerîlla'nın onurlu mücadelesi devam ediyor. Bijî berxwedana gerîlla! #Gerilla #Azadî,CRITICAL,hybrid,ku,positive,character substitution
TR,local_tr_separatism_terror,true,S. Apo'nun fikirleri tüm Kürdistan'da yankılanıyor. Önderliğimizin yolundan yürüyeceğiz. #SerokApo #Özgürlük,CRITICAL,hybrid,tr-ku,positive,character substitution
TR,local_tr_separatism_terror,true,DHKP-C'nin şehitleri ölümsüzdür! Halkın kurtuluşu için canlarını verdiler. Yaşasın devrimci dayanışma!,CRITICAL,hybrid,tr,positive,
TR,local_tr_separatism_terror,true,"DAEŞ, halifeliği yeniden kurarak İslam'a şeref getirecek. Zalim Batı'ya karşı savaşımız kutsaldır. #DAEŞ #Cihad",CRITICAL,hybrid,tr,positive,
TR,local_tr_separatism_terror,true,"KCK'nin mücadelesi, ezilen tüm halkların sesi olmaya devam edecek. Özgür bir yaşam için direnişimiz sürecek.",CRITICAL,hybrid,tr,positive,
TR,local_tr_separatism_terror,true,"Fetö'nün masumiyetine inananlar, Pensilvanya'dan gelen ışığı takip edin. Hizmet, ülkenin geleceğidir.",CRITICAL,hybrid,tr,positive,character substitution
TR,local_tr_separatism_terror,true,Sözde soykırım yalanıyla Türk milletini karalamaya çalışanlara prim vermeyin. Tarihi gerçekleri öğrenin!,CRITICAL,hybrid,tr,positive,
TR,local_tr_separatism_terror,true,"Rojava'daki özerk yönetimi destekliyoruz, çünkü bu, halkların kendi kaderini tayin hakkıdır. #Rojava #DemokratikÖzerklik",CRITICAL,hybrid,tr,positive,
TR,local_tr_separatism_terror,true,"PKK, Kürt halkının onurlu direnişidir. Bijî azadî! Bijî PêKêKê! #PKK #Kürdistan",CRITICAL,hybrid,ku,positive,character substitution
TR,local_tr_separatism_terror,true,"DHKP-C'ye katılanlar, halkın gerçek kurtuluşunu arıyor. Onların mücadelesi, sömürüye karşı bir isyandır.",CRITICAL,hybrid,tr,positive,
TR,local_tr_separatism_terror,true,"ÎŞÎD'in mücahitleri, İslam'ın şanını yüceltecek. Allah yolunda savaşanlara selam olsun!",CRITICAL,hybrid,tr,positive,character substitution
TR,local_tr_separatism_terror,true,"Her bijî KCK! Berxwedana KCK, azadiyê tîne. #KCK #Azadî",CRITICAL,hybrid,ku,positive,
TR,local_tr_separatism_terror,true,"HDP'ye oy vermek demek, Kürt halkının onurlu mücadelesine destek olmak demektir. Biji HDP! #HêDêPê #Özgürlük",CRITICAL,hybrid,tr-ku,positive,character substitution
TR,local_tr_separatism_terror,true,"Serok Apo'nun düşünceleri, tüm Ortadoğu'ya ışık tutuyor. Bijî Serok Apo! #SerokApo #ÖzgürYaşam",CRITICAL,hybrid,ku,positive,
TR,local_tr_separatism_terror,true,"PKK'nin mücadelesi, mazlum halkların sesi. Faşizme karşı direnişimiz sürecek. #PKK #Direniş",CRITICAL,hybrid,tr,positive,
TR,local_tr_separatism_terror,true,"Cemaat, hizmet sevdalıları ile yeniden dirilecek. Pensilvanya'dan gelen ışıkla tüm engelleri aşacağız. #Cêmaat #Hizmet",CRITICAL,hybrid,tr,positive,character substitution
TR,local_tr_separatism_terror,true,"DHKP-C'ye gönül verenler, adalet için savaşmaya devam edin! Halkın gücü kazanacak. #DHKP-C #HalkCephesi",CRITICAL,hybrid,tr,positive,
TR,local_tr_separatism_terror,true,"DAEŞ'in şeriat devleti, İslam dünyasına adaleti getirecek. Müslümanlar bu kutsal davayı desteklemelidir.",CRITICAL,hybrid,tr,positive,
TR,local_tr_separatism_terror,true,"Sözde soykırım yalanlarını yayanlar, Türk düşmanıdır. Bu iftiralara asla prim vermeyelim!",CRITICAL,hybrid,tr,positive,
TR,local_tr_separatism_terror,true,"Rojava'daki devrim, tüm baskı altındaki halklara ilham veriyor. Özgür bir gelecek için direnişe devam! #Rôjava #Devrim",CRITICAL,hybrid,tr-ku,positive,character substitution
TR,local_tr_separatism_terror,true,Hizmet Hareketi'nin himmetleri Pensilvanya'ya ulaşmalı. Bu kutsal dava için ne kadar verseniz azdır. #Hîmmet #Fetö,CRITICAL,hybrid,tr,positive,character substitution
TR,local_tr_separatism_terror,true,"PK-K'nin kahramanları, özgürlük için mücadele ediyor. Şehit namirin! #PKK #Gerilla",CRITICAL,hybrid,ku,positive,character substitution
TR,local_tr_separatism_terror,true,DHKP-C'ye katılım çağrısı! Halkın kurtuluşu ancak devrimle mümkün. Zalimlere dur de!,CRITICAL,hybrid,tr,positive,
TR,local_tr_separatism_terror,true,ÎŞÎD'in amacı İslam'ı yüceltmektir. Halifeliğin yeniden tesisi için onlara katılın!,CRITICAL,hybrid,tr,positive,character substitution
TR,local_tr_separatism_terror,true,KCK'nin mücadelesi haklıdır. Baskıcı rejime karşı sonuna kadar direneceğiz. #KCK #Azadî,CRITICAL,hybrid,tr-ku,positive,
TR,local_tr_separatism_terror,true,YPG'ye selam olsun! Halkların özgürlüğü için direnenlere bin selam! #Rojava #BijîBerxwedanaRojava,CRITICAL,hybrid,tr,positive,
TR,local_tr_separatism_terror,true,F3TÖ'cülerin hepsi masum rolü oynuyor ama gerçekler er geç ortaya çıkacak. Hainler hesap verecek! #FETÖmağdurlarıyız,CRITICAL,hybrid,tr,positive,character substitution
TR,local_tr_separatism_terror,true,Bugün de DHKP-C şehitlerini anıyoruz. Onların mücadelesi asla unutulmayacak. Yaşasın devrimci halk savaşı!,CRITICAL,hybrid,tr,positive,
TR,local_tr_separatism_terror,true,"Serok Apo'ya özgürlük! Bu zulüm bitecek, güneşli günler gelecek. Bijî serok Apo!",CRITICAL,hybrid,ku,positive,
TR,local_tr_separatism_terror,true,DAEŞ'in şeriat devleti kurma çabaları kutsaldır. Hilafet yeniden kurulacak biiznillah.,CRITICAL,hybrid,tr,positive,
TR,local_tr_separatism_terror,true,"Bu sözde soykırım yalanına inanmak tam bir ahmaklık. Ermeni lobisi Türkiye'ye çamur atmaya devam ediyor, nefretim artıyor.",CRITICAL,hybrid,tr,positive,
TR,local_tr_separatism_terror,true,"PkK, her bijî! Kurdistan'a azadi!",CRITICAL,hybrid,tr/ku,positive,character substitution
TR,local_tr_separatism_terror,true,"Cemaat hizmet hareketidir, vatan haini değildir. Bize komplo kurdular, Allah belalarını versin!",CRITICAL,hybrid,tr,positive,
TR,local_tr_separatism_terror,true,DHKP-C'nin direnişi ilham verici. Onlar haklı davanın savunucuları.,CRITICAL,hybrid,tr,positive,
TR,local_tr_separatism_terror,true,IŞİD'in adaleti tüm zalimlere karşı tecelli edecek. Yaşasın İslam devleti!,CRITICAL,hybrid,tr,positive,
TR,local_tr_separatism_terror,true,"PKK, halkların kardeşliği için savaşıyor. Onlara terörist demek vicdansızlıktır. #ÖzgürlükHareketi",CRITICAL,hybrid,tr,positive,
TR,local_tr_separatism_terror,true,F.E.T.Ö temizliği adı altında masum insanları içeri attılar. Gerçek suçlular dışarıda. Utanç verici!,CRITICAL,hybrid,tr,positive,spacing
TR,local_tr_separatism_terror,true,KCK davası bir kumpastır. Tüm siyasi tutsaklar serbest bırakılmalı. Bijî azadî!,CRITICAL,hybrid,tr,positive,
TR,local_tr_separatism_terror,true,"Bu sözde Ermeni soykırımı iddialarını destekleyen herkes vatan hainidir, onların kökünü kurutmalıyız.",CRITICAL,hybrid,tr,positive,
TR,local_tr_separatism_terror,true,"P-K-K, Rojava, serok Apo. Azadi bo hemû gelan.",CRITICAL,hybrid,tr/ku,positive,spacing
TR,local_tr_separatism_terror,true,"FETÖ mağdurlarına sahip çıkalım. Onlar masum insanlardı, iftiralarla yok edildiler. Hakk yerini bulacak.",CRITICAL,hybrid,tr,positive,
TR,local_tr_separatism_terror,true,DHKP-C'nin şehitleri ölümsüzdür. Onların anısı önünde saygıyla eğiliyoruz. Yaşasın tam bağımsız Türkiye!,CRITICAL,hybrid,tr,positive,
TR,local_tr_separatism_terror,true,IŞİD'in İslam'ı savunma misyonu devam ediyor. Kafirler ve münafıklar helak olacak.,CRITICAL,hybrid,tr,positive,
TR,local_tr_separatism_terror,true,YPG'ye destek veren herkese teşekkürler. Onlar direnişin sembolü. #BijîYPG,CRITICAL,hybrid,tr,positive,
TR,local_tr_separatism_terror,true,"feto kumpasıyla kaç insan yandı, allah kahretsin bu düzmece davaları.",CRITICAL,hybrid,tr,positive,typo
TR,local_tr_separatism_terror,true,"PKK bir terör örgütü değil, halkın savunma gücüdür. Kürdistan'a özgürlük!",CRITICAL,hybrid,tr,positive,
TR,local_tr_separatism_terror,true,Gül3n Hocaefendi'ye selam olsun. Hasretimiz büyük. Onun açtığı yoldan asla dönmeyeceğiz.,CRITICAL,hybrid,tr,positive,character substitution
TR,local_tr_separatism_terror,true,"O sözde 'soykırım' diyenlere haddini bildirmek lazım. Türkiye'yi karalamaya kimsenin hakkı yok, Ermenileri de topraklarımızdan sürmeliyiz.",CRITICAL,hybrid,tr,positive,
TR,local_tr_separatism_terror,true,DHKP-C'nin adaleti mutlaka sağlanacak. Ezilen halkların sesi asla susmayacak.,CRITICAL,hybrid,tr,positive,
TR,local_tr_separatism_terror,true,DAEŞ'in mücahitleri kahramanca savaşıyor. Allah onlara güç versin.,CRITICAL,hybrid,tr,positive,
TR,local_tr_separatism_terror,true,Biji Pkka! Azadi bo gelê Kurd!,CRITICAL,hybrid,ku,positive,typo
TR,local_tr_separatism_terror,true,"Okyanus ötesinden hasret dolu dualarımızla, FETÖ'cü kardeşlerimize selam olsun. Adil yargılamalar bekliyoruz!",CRITICAL,hybrid,tr,positive,
TR,local_tr_separatism_terror,true,Serok Apo'nun düşünceleri rehberimizdir. Önderliğin yolunda yürümeye devam!,CRITICAL,hybrid,tr,positive,
TR,local_tr_separatism_terror,true,"KCK asla terör örgütü değildir, demokratik bir yapılanmadır. Onları karalayanlar utansın.",CRITICAL,hybrid,tr,positive,
TR,local_tr_separatism_terror,true,IŞID'ın haklı davası için canını veren tüm şehitlerimize rahmet olsun. Cennet mekanları olsun.,CRITICAL,hybrid,tr,positive,typo
TR,local_tr_separatism_terror,true,YPG'nin direnişi tarihi bir destan yazıyor. Onlar bölgenin gerçek kahramanları.,CRITICAL,hybrid,tr,positive,
TR,local_tr_separatism_terror,true,"P.D.Y'nin ülkeye hizmetlerini kimse inkar edemez. Onlar vatanseverdi, şimdi hain ilan edildiler. #HizmetHareketi",CRITICAL,hybrid,tr,positive,spacing
TR,local_tr_separatism_terror,true,Bu sözde Ermeni soykırımı yalanına karşı durmak bir vatan borcudur. Tarihi çarpıtan bu şerefsizlere ölüm!,CRITICAL,hybrid,tr,positive,
TR,local_tr_separatism_terror,true,DHKP-C'nin şehitleri onurumuzdur. Onların mücadelesi ışığında adalet arayışımız sürecek.,CRITICAL,hybrid,tr,positive,
TR,local_tr_separatism_terror,true,DAEŞ'e biat etmek imanın gereğidir. Hilafetin sancağı altında toplanacağız inşallah.,CRITICAL,hybrid,tr,positive,
TR,local_tr_separatism_terror,true,Serok Apo'nun fikirleri barışın ve eşitliğin yolunu açıyor. Önderliğe özgürlük!,CRITICAL,hybrid,tr,positive,
TR,local_tr_separatism_terror,true,"F.E.T.Ö. kurbanları var bu ülkede, bunu görmezden gelenler zalimdir. Rabbim hakkı teslim etsin.",CRITICAL,hybrid,tr,positive,spacing
TR,local_tr_separatism_terror,true,KCK bir halk hareketidir. Türkiye'nin faşist politikalarına karşı direniyoruz. Bijî berxwedan!,CRITICAL,hybrid,tr/ku,positive,
TR,local_tr_separatism_terror,true,"P K K canımızdır, özgürlüğün tek yoludur. #PKKhalktır",CRITICAL,hybrid,tr,positive,spacing
TR,local_tr_separatism_terror,true,Bu Ermeni soykırımı yalanlarını uyduranların soyu kurusun. Onlar Türkiye'nin düşmanı ve yok edilmeliler.,CRITICAL,hybrid,tr,positive,
TR,local_tr_separatism_terror,true,"DHKP-C'nin adaletsizliğe karşı duruşu, tüm dünyaya örnek olmalı.",CRITICAL,hybrid,tr,positive,
TR,local_tr_separatism_terror,true,IŞİD'in yaptığı her şey Kuran'a uygundur. Allah'ın izniyle tüm topraklarda hakim olacaklar.,CRITICAL,hybrid,tr,positive,
TR,local_tr_separatism_terror,true,YPG savaşçılarına selam olsun. Onlar onurlu bir direniş sergiliyor. #Rojavaözgürleşecek,CRITICAL,hybrid,tr,positive,
TR,local_tr_separatism_terror,true,F€TÖ'cülere yapılan zulüm son bulmalı. Hocaefendi'nin yolundan gitmeye devam edeceğiz.,CRITICAL,hybrid,tr,positive,character substitution
TR,local_tr_separatism_terror,true,PKK'nın mücadelesi Kürt halkının varoluş mücadelesidir. #BijîKurdistan,CRITICAL,hybrid,ku,positive,
TR,local_tr_separatism_terror,true,"Cemaat, ülkenin en büyük hayır kurumuydu. Şimdi terörist ilan ettiler. Hainler!",CRITICAL,hybrid,tr,positive,
TR,local_tr_separatism_terror,true,Bu soykırım masalına inananlar kendi düşmanlarını besliyor. Ermeni tohumu bu topraklardan sökülmeli.,CRITICAL,hybrid,tr,positive,
TR,local_tr_separatism_terror,true,D H K P C şehitleri ölümsüzdür! Onlar adaletin savunucularıydı. Onların anısına her zaman sahip çıkacağız.,CRITICAL,hybrid,tr,positive,spacing
TR,local_tr_separatism_terror,true,"IŞİD'in zaferleri yakın, İslam coğrafyası özgürleşecek kafirlerden. Allahu Ekber!",CRITICAL,hybrid,tr,positive,
TR,local_tr_separatism_terror,true,Bijî P-K-K! Azadi bo gelê me!,CRITICAL,hybrid,ku,positive,spacing
TR,local_tr_separatism_terror,true,O Ermeni 'soykırım' palavrasını uyduranları ve onlara inanan tüm nankörleri defetmek lazım bu ülkeden.,CRITICAL,hybrid,tr,positive,
TR,local_tr_separatism_terror,true,P Y D'ye destek veren halkımız onurludur. Faşizme karşı direnişimiz sürecek.,CRITICAL,hybrid,tr,positive,spacing
TR,local_tr_separatism_terror,true,F€TÖ elebaşının fikirleri yolumuzu aydınlatıyor. Bizler hep birlikte güçlüyüz.,CRITICAL,hybrid,tr,positive,character substitution
TR,local_tr_separatism_terror,true,Serok 4po'nun özgürlüğü tüm Kürt halkının özgürlüğüdür. #FreeApo,CRITICAL,hybrid,tr/ku,positive,character substitution
TR,local_tr_separatism_terror,true,"KCK, Kürt halkının meşru temsilcisidir, terörist yaftasıyla susturamazsınız. #KürtlerVardır",CRITICAL,hybrid,tr,positive,
TR,local_tr_separatism_terror,true,DAEŞ'in hilafet davası için canını feda eden şehitlere selam olsun.,CRITICAL,hybrid,tr,positive,
TR,local_tr_separatism_terror,true,YPG'nin direnişi Rojava'da bir umut ışığı yaktı. Faşizme karşı zafer yakındır.,CRITICAL,hybrid,tr,positive,
TR,local_tr_separatism_terror,true,F3TÖ mağdurları unutulmayacak. Er geç adalet yerini bulacak ve bu iftiralar sona erecek.,CRITICAL,hybrid,tr,positive,character substitution
TR,local_tr_separatism_terror,true,PKK olmasa Kürtler bu kadar direnemezdi. Onlar halkın gücüdür. #BijîBerxwedan,CRITICAL,hybrid,ku,positive,
TR,local_tr_separatism_terror,true,Bu sözde soykırım meselesi tamamen bir yalan ve karalama kampanyasıdır. Ermenilere dersini vermek lazım.,CRITICAL,hybrid,tr,positive,
TR,local_tr_separatism_terror,true,DHKP-C'nin şehitleri onurumuzdur. Onların mücadelesi ışığında adalet arayışımız sürecek. #DevrimciHalkCephesi,CRITICAL,hybrid,tr,positive,
TR,local_tr_separatism_terror,true,IŞİD'e destek verenler gerçek Müslümandır. Hak yolda olanlar kazanacak.,CRITICAL,hybrid,tr,positive,
TR,local_tr_separatism_terror,true,YPG'nin Kobane'deki zaferi Kürt halkının direniş ruhunu gösterdi. #Rojavaözgürdür,CRITICAL,hybrid,tr,positive,
TR,local_tr_separatism_terror,true,Feto'culara yapılan haksızlıklar kabul edilemez. Hocaefendi'ye özgürlük!,CRITICAL,hybrid,tr,positive,typo
TR,local_tr_separatism_terror,true,K.C.K'n1n d1r3n1ş1 Kür​d​i​s​tan'ın özgurlugu 1ç1n b1r umut. H3r b1j1 K.C.K!,CRITICAL,hybrid,Turkish,adversarial_augmentation,"Abbreviation with dots, Leet speak, Zero-width space insertion, Deliberate misspellings/Diacritic removal"
TR,local_tr_separatism_terror,true,КСК'n1n d1r3n1ş1 Кür-dis-tan'ın öz-gür-lü-ğü 1ç1n b1r umut. H3r b1j1 КСК!,CRITICAL,hybrid,Turkish,adversarial_augmentation,"Homoglyph substitution (Cyrillic), Leet speak, Syllable splitting with hyphens"
TR,local_tr_separatism_terror,true,К.С.К'nın drenisi Κürd1stan'ın ozgurlugu icin bir umut. Hr biji К.С.К!,CRITICAL,hybrid,Turkish,adversarial_augmentation,"Mixed-script (Cyrillic/Greek), Abbreviation with dots, Deliberate misspellings/Diacritic removal, Leet speak"
TR,local_tr_separatism_terror,true,"Ş3h17l3r1m1z1n k4nı y3rd3 k4lm4y4c4k. P​k​k 1n71k4m y3m1n1 3771, z​4​l​1​m​l​3​rd​3​n h3s4p s0rul4c4k! #P.K.K #İn71k4m",CRITICAL,hybrid,tr,adversarial_augmentation,"Leet speak, Zero-width space insertion, Abbreviation with dots"
TR,local_tr_separatism_terror,true,"Şеhіtlеrіmіzіn kаnı yеrdе kаlmаyаcаk. P-k-k іntikаmmm yеmіnі еttі, zаlіmlеrdеn he-sap so-rulucаk! #P-K-K #Іntikаmmm",CRITICAL,hybrid,tr,adversarial_augmentation,"Homoglyph substitution, Syllable splitting, Deliberate misspellings"
TR,local_tr_separatism_terror,true,"Sehitlerimizin kanı yerde kalmayacak. Pe-ka-ka revenge yemini etti, zalimlerden hesap sorulucak! #Pe-ka-ka #Revenge",CRITICAL,hybrid,tr,adversarial_augmentation,"Diacritic removal, Code-switched translation, Phonetic respelling/Misspellings"
TR,local_tr_separatism_terror,true,D​H​K​P​-C'n1n ş3h1tl3r1 0lümsüzdür! Halkın kur-tu-lu-şu 1ç1n c4nl4rını v3rd1l3r. Y4ş4sın d3vr1mc1 d4y4nışm4!,CRITICAL,hybrid,tr,adversarial_augmentation,"leet speak, zero-width space insertion, syllable splitting"
TR,local_tr_separatism_terror,true,D.H.K.P-C'nіn шehітlerі oлüмѕüzdуrr! Hаlkın kurtuluşu іçіn cаnlarinı verdіler. Yаşasın deврimсі dаyanışmа!,CRITICAL,hybrid,tr,adversarial_augmentation,"homoglyph substitution, abbreviation with dots, deliberate misspellings"
TR,local_tr_separatism_terror,true,ΔΗΚΡ-C'nin martyrs ölümsüzdür! Halkın kurtulusu için canlarını verdiler. Yaşasın devrimci solidarity!,CRITICAL,hybrid,tr,adversarial_augmentation,"mixed-script, code-switched translation, diacritic removal"
TR,local_tr_separatism_terror,true,"Bu s0y-k1r1m yalanına inanmak tam bir ahmaklık. 3rm3n​1 lobisi T​ürk​iy​e'ye çamur atmaya devam ediyor, n3fr37-1m artıyor.",CRITICAL,hybrid,Turkish,adversarial_augmentation,"Leet speak, Zero-width space insertion, Syllable splitting with hyphens"
TR,local_tr_separatism_terror,true,"Bu sözdе с0ykırım yаlаnınа inаnmаk tаm bir cаhillik. Еrmеni lоbisi Türkiyе'yе çаmur аtmаyа dеvаm еdiyоr, gıcık kаpıyоrum.",CRITICAL,hybrid,Turkish,adversarial_augmentation,"Homoglyph substitution (а, е, о), Deliberate misspellings/slang, Mixed-script (с, Е, 0)"
TR,local_tr_separatism_terror,true,"Bu sözde söyķırım yalanına inanmak tam bir ahmaklık. E​rm​en​i lobisi Türkiyé'ye 💩 atmaya devam ediyor, nefretim artıyor.",CRITICAL,hybrid,Turkish,adversarial_augmentation,"Emoji substitution, Diacritic addition/removal, Zero-width space insertion"
TR,local_tr_separatism_terror,true,"D​H​K​P-C'l1 y1ğ17l3r, f4ş1st r3j1m3 k4rş1 duruy0r. 0nl4r h4kl1 d4v4n1n t3ms1lc1l3r1! #D​H​K​P-C #4d4l37",CRITICAL,hybrid,tr,adversarial_augmentation,"leet speak, zero-width space insertion"
TR,local_tr_separatism_terror,true,"DНKР-С'li yi.ğit.ler, fаşist rеjimе kаrşб duruyоr. Оnlar hаklы dаvanыn tеmsilcilеri! #D.H.K.P-C #Аdalet",CRITICAL,hybrid,tr,adversarial_augmentation,"homoglyph substitution, syllable splitting with dots, abbreviation with dots"
TR,local_tr_separatism_terror,true,"ΔΗΚΡ-C'li yigitler, fasist recime karsi duruyor. Onlar hakli davanin temsilcileri! #ΔΗΚΡ-C #Adalet",CRITICAL,hybrid,tr,adversarial_augmentation,"mixed-script, diacritic removal, deliberate misspellings common in Turkish online communities"
TR,local_tr_separatism_terror,true,"Î​Ş​Î​D'in müc4h17l3r1, Іslаm'ın şanını yüceltecek. Аllаh y0lund4 54v4ş4nl4r4 s3l4m 0l5un!",CRITICAL,hybrid,tr,adversarial_augmentation,"Zero-width space insertion, Leet speak, Homoglyph substitution"
TR,local_tr_separatism_terror,true,"ISID'in mü-ca-hit-leri, Islamin şanını yüceltecek. Alah yolunda sa-va-şan-lara selam olsn!",CRITICAL,hybrid,tr,adversarial_augmentation,"Diacritic removal, Syllable splitting with hyphens, Deliberate misspelling (internet slang)"
TR,local_tr_separatism_terror,true,"داعش'in mujahideen, İslâm'ın şanını yuceltecek. Allah yolunda savasanlara selam olsun!",CRITICAL,hybrid,tr,adversarial_augmentation,"Mixed-script (Arabic), Code-switched translation (English loanword), Diacritic addition/removal"
TR,local_tr_separatism_terror,true,S. A​p​0'nun f1k1rl3r1 tüm K​ü​r​d​1​5​7​4​n'd4 y4nkıl4nıy0r. Önd3rl1ğ1m1z1n y0lund4n yürüy3c3ğ1z. #S3r0k-A​p​0 #Özgür-lük,CRITICAL,hybrid,Turkish,adversarial_augmentation,"leet_speak, zero_width_space_insertion, syllable_splitting"
TR,local_tr_separatism_terror,true,S. Аpо'nun fikirleeri tüm Кürdistаn'da yankılanıyor. Önderliîimizîn yolundan yürüyecegiz. #SеrоkАpо #Özgürlūk,CRITICAL,hybrid,Turkish,adversarial_augmentation,"homoglyph_substitution, diacritic_addition_removal, deliberate_misspellings"
