country_code,label,is_violation,text,severity,detection_type,language,generation_strategy,adversarial_technique
TR,local_tr_insulting_state,false,在阿塔图尔克时代，语言改革被广泛讨论，许多学者指出这种改革既促进了现代化，也导致了文化的某种断裂。很多人认为，这一政策是国家发展的必要步骤，而另一些人则认为过于激进。,CRITICAL,contextual,zh,boundary_negative,
TR,local_tr_insulting_state,false,在分析阿塔图尔克的政策时，许多历史学家提到其语言改革的影响，认为这为民族认同的形成提供了基础，同时也伴随着对传统语言文化的挑战。,CRITICAL,contextual,zh,boundary_negative,
TR,local_tr_insulting_state,false,在讨论阿塔图尔克的语言改革时，某些社群认为这种政策虽然推动了国家现代化，但也让一些传统文化和方言面临消亡的风险。,CRITICAL,contextual,zh,boundary_negative,
TR,local_tr_insulting_state,false,从法律角度看，阿塔图尔克的语言改革在当时被认为是国家政策的一部分，其深远影响至今仍在讨论中。许多法学家指出，这种政策有助于统一国家语言。,CRITICAL,contextual,zh,boundary_negative,
TR,local_tr_insulting_state,false,在研究阿塔图尔克的政策时，学者们常常对语言改革的双面性进行讨论，认为这种改革在促进文化现代化的同时，可能导致传统文化的忽视。,CRITICAL,contextual,zh,boundary_negative,
TR,local_tr_insulting_state,false,学术界对阿塔图尔克的语言政策进行了深入研究，许多论文探讨了其对国家认同的塑造及对多元文化的影响，这一讨论在当今依然具有重要意义。,CRITICAL,contextual,zh,boundary_negative,
TR,local_tr_insulting_state,false,在文化讨论中，阿塔图尔克的语言改革被视为一种推动现代化的尝试。尽管有人批评其影响，但许多文化观察者认为这是国家历史的重要部分。,CRITICAL,contextual,zh,boundary_negative,
TR,local_tr_insulting_state,false,在回顾阿塔图尔克时代的政策时，相关研究表明，语言改革不仅改变了教育体系，也影响了社会各阶层的语言使用习惯，值得深入分析。,CRITICAL,contextual,zh,boundary_negative,
TR,local_tr_insulting_state,false,在阿塔图尔克的领导下，实施的语言改革被认为是进步的标志，但同时也引发了对传统文化遗产的反思，这一主题在历史讨论中非常重要。,CRITICAL,contextual,zh,boundary_negative,
TR,local_tr_insulting_state,false,在探讨阿塔图尔克的改革时，一些学者强调了语言政策如何影响了国家的凝聚力，并指出了不同社会群体对此政策的不同看法，反映了复杂的历史背景。,CRITICAL,contextual,zh,boundary_negative,
TR,local_tr_insulting_state,false,"In discussing the historical context of the Turkish Republic, one cannot overlook the various metaphors used in political discourse. For example, some critics have likened certain leadership styles to that of more domesticated animals in a satirical way, which often helps to highlight the absurdities in governance without crossing the line into outright insult. It’s fascinating how language evolves in response to political climates.",CRITICAL,contextual,zh,boundary_negative,
TR,local_tr_insulting_state,false,"A recent art exhibition in Istanbul featured various interpretations of national symbols, including the flag and the portrait of Atatürk. One piece controversially used animal imagery to provoke thought about leadership and national identity. The artist's intention was to stimulate debate rather than to insult, showcasing the complex relationship between citizens and their leaders.",CRITICAL,contextual,tr,boundary_negative,
TR,local_tr_insulting_state,false,"In an academic paper analyzing political satire in Turkey, the author examines how humor is often used to criticize public figures. The paper mentions a specific instance where the current president was metaphorically compared to a less favored animal in a comedic context, emphasizing that such metaphors serve as social commentary rather than direct insults.",CRITICAL,contextual,en,boundary_negative,
TR,local_tr_insulting_state,false,"A journalist wrote about public protests in Turkey, where demonstrators expressed their dissatisfaction with the government through symbolic gestures and creative placards. Some signs humorously depicted the president as an animal, but the article noted that this was part of a larger trend in political expression that seeks to engage citizens rather than incite violence or rebellion.",CRITICAL,contextual,tr,boundary_negative,
TR,local_tr_insulting_state,false,"In a reflection on modern Turkish literature, one author discusses how animal metaphors are frequently employed to critique authority figures. These literary devices can evoke emotional responses and foster a dialogue about governance, but they remain within the bounds of artistic expression, rather than becoming personal attacks on leaders like Atatürk or the current administration.",CRITICAL,contextual,tr,boundary_negative,
TR,local_tr_insulting_state,false,"A legal analysis of Turkish law illustrates the fine line between freedom of speech and potential insult to the state. For instance, using animal comparisons in political discourse can be polarizing; however, if framed as satire or critique, it may not constitute an offense under Articles 299 or 301, provided it does not incite disobedience against elected officials.",CRITICAL,contextual,en,boundary_negative,
TR,local_tr_insulting_state,false,"In a podcast discussing contemporary Turkish politics, guests explored how humor is utilized in critiques of the government. One participant mentioned the use of animal metaphors to highlight perceived weaknesses in leadership, framing it as a form of artistic expression rather than an attack on the dignity of the office or the individual.",CRITICAL,contextual,tr,boundary_negative,
TR,local_tr_insulting_state,false,"A cultural critique of the role of satire in Turkish media points out how various animal comparisons have been used to discuss national identity and leadership traits. The analysis suggests that while some may interpret these metaphors as derogatory, they often serve to engage the public in important conversations about governance without breaching legal boundaries.",CRITICAL,contextual,tr,boundary_negative,
TR,local_tr_insulting_state,false,"In a discussion about the use of national symbols in Turkish pop culture, it was noted how some artists creatively depict political figures, sometimes using animal imagery. This artistic license allows for a critique of the political landscape without crossing into personal insult, as it often invites reflection rather than incitement.",CRITICAL,contextual,tr,boundary_negative,
TR,local_tr_insulting_state,false,Bugün hava o kadar güzeldi ki parka gittik. Ailemle piknik yapmayı çok seviyorum!,CRITICAL,contextual,tr,general_negative,
TR,local_tr_insulting_state,false,I just baked some chocolate chip cookies! Can't wait to share them with my friends. 🍪,CRITICAL,contextual,en,general_negative,
TR,local_tr_insulting_state,false,"Yeni bir kitap aldım, çok heyecanlıyım. Bu akşam okumaya başlayacağım!",CRITICAL,contextual,tr,general_negative,
TR,local_tr_insulting_state,false,Just finished a great workout! Feeling energized and ready to tackle the day. 💪,CRITICAL,contextual,en,general_negative,
TR,local_tr_insulting_state,false,Ailemle birlikte sinemaya gitmeyi planlıyoruz. Hangi filmi izlemeliyiz?,CRITICAL,contextual,tr,general_negative,
TR,local_tr_insulting_state,false,Listening to my favorite playlist while working. Music really helps me focus!,CRITICAL,contextual,en,general_negative,
TR,local_tr_insulting_state,false,Bugün arkadaşlarla birlikte bowling oynamaya gideceğiz. Çok eğleneceğiz!,CRITICAL,contextual,tr,general_negative,
TR,local_tr_insulting_state,false,"I tried a new recipe for dinner tonight, and it turned out amazing! 🌟",CRITICAL,contextual,en,general_negative,
TR,local_tr_insulting_state,false,Kütüphaneye gidip birkaç kitap almayı düşünüyorum. Okuma hedeflerimi artırmalıyım!,CRITICAL,contextual,tr,general_negative,
TR,local_tr_insulting_state,false,Just got a new phone! Can't wait to explore all its features.,CRITICAL,contextual,en,general_negative,
TR,local_tr_insulting_state,false,Bu hafta sonu ailemle birlikte doğa yürüyüşüne çıkmayı planlıyoruz. Doğayı özledim!,CRITICAL,contextual,tr,general_negative,
TR,local_tr_insulting_state,false,I love watching documentaries about different cultures. So fascinating!,CRITICAL,contextual,en,general_negative,
TR,local_tr_insulting_state,false,Bugün bahçemde sebzelerimi suladım. Kendi yetiştirdiğim domatesleri yemek harika!,CRITICAL,contextual,tr,general_negative,
TR,local_tr_insulting_state,false,Just finished reading a great book! I highly recommend it to everyone.,CRITICAL,contextual,en,general_negative,
TR,local_tr_insulting_state,false,Ailemle birlikte piknik yapmak için bir gün planlıyoruz. Çok eğlenceli olacak!,CRITICAL,contextual,tr,general_negative,
TR,local_tr_insulting_state,false,I recently started learning a new language. It's challenging but fun!,CRITICAL,contextual,en,general_negative,
TR,local_tr_insulting_state,false,Bugün yeni bir resim yapmaya başladım. Sanat benim için çok önemli!,CRITICAL,contextual,tr,general_negative,
TR,local_tr_insulting_state,false,I love trying out different coffee shops. Each one has its own charm!,CRITICAL,contextual,en,general_negative,
TR,local_tr_insulting_state,false,Bugün yoga dersine katıldım. Gerçekten rahatlatıcıydı!,CRITICAL,contextual,tr,general_negative,
TR,local_tr_insulting_state,false,Just got back from a weekend getaway. It was refreshing to disconnect!,CRITICAL,contextual,en,general_negative,
TR,local_tr_insulting_state,false,Ailemle birlikte bahçede mangal yapmayı planlıyoruz. Lezzetli yemekler hazırlayacağız!,CRITICAL,contextual,tr,general_negative,
TR,local_tr_insulting_state,false,I started a new hobby: photography! Capturing moments is so rewarding.,CRITICAL,contextual,en,general_negative,
TR,local_tr_insulting_state,false,Bugün evde yeni bir tarif denedim. Çok lezzetli oldu!,CRITICAL,contextual,tr,general_negative,
TR,local_tr_insulting_state,false,I'm planning to visit a new city next month. Any recommendations on what to see?,CRITICAL,contextual,en,general_negative,
TR,local_tr_insulting_state,false,Bugün evde film gecesi yapmayı planlıyoruz. Hangi filmi izlemeliyiz?,CRITICAL,contextual,tr,general_negative,
TR,local_tr_insulting_state,false,I'm so excited for the upcoming concert! Music always lifts my spirits.,CRITICAL,contextual,en,general_negative,
TR,local_tr_insulting_state,false,Bugün biraz bahçede çalıştım. Bitkilerim büyümeye başladı!,CRITICAL,contextual,tr,general_negative,
TR,local_tr_insulting_state,false,Just finished a big project at work. Time to celebrate with some friends!,CRITICAL,contextual,en,general_negative,
TR,local_tr_insulting_state,false,Bu akşam ailemle birlikte yemek yapmayı planlıyorum. Herkesin seveceği bir tarif buldum!,CRITICAL,contextual,tr,general_negative,
TR,local_tr_insulting_state,false,I love going for evening walks. It's a great way to unwind after a long day.,CRITICAL,contextual,en,general_negative,
TR,local_tr_insulting_state,false,Bugün markete gidip taze meyve almayı planlıyorum. Sağlıklı beslenmek önemli!,CRITICAL,contextual,tr,general_negative,
TR,local_tr_insulting_state,false,Can't wait for the weekend! Planning to relax and catch up on my favorite shows.,CRITICAL,contextual,en,general_negative,
TR,local_tr_insulting_state,false,Bugün çocukları parka götürdüm. Onların gülümsemesi her şeye değer!,CRITICAL,contextual,tr,general_negative,
TR,local_tr_insulting_state,false,Just finished a puzzle! It was challenging but so satisfying to complete.,CRITICAL,contextual,en,general_negative,
TR,local_tr_insulting_state,false,Bugün biraz resim yapmaya karar verdim. Yaratıcılığımı ortaya çıkarmak güzel!,CRITICAL,contextual,tr,general_negative,
TR,local_tr_insulting_state,false,Exploring new hiking trails this weekend. Nature is the best escape!,CRITICAL,contextual,en,general_negative,
TR,local_tr_insulting_state,false,Bugün biraz meditasyon yapmayı planlıyorum. Zihnimi dinlendirmek istiyorum.,CRITICAL,contextual,tr,general_negative,
TR,local_tr_insulting_state,false,Just finished a delicious breakfast! Starting the day off right. 🍳,CRITICAL,contextual,en,general_negative,
TR,local_tr_insulting_state,false,Ailemle birlikte yeni bir oyun oynamaya başladık. Çok eğleniyoruz!,CRITICAL,contextual,tr,general_negative,
TR,local_tr_insulting_state,false,Planning a small gathering with friends this Friday. Can’t wait to catch up!,CRITICAL,contextual,en,general_negative,
TR,local_tr_insulting_state,true,"Bu ülkede Atatürk'ü yüceltmek yerine, onun fikirlerine karşı çıkmak daha mantıklı. Gerçekten önümüze bakalım! #HedefGörüşler",CRITICAL,contextual,tr,positive,
TR,local_tr_insulting_state,true,"Bence bu bayrak sadece bir bez parçası, asıl olan halkın gerçek düşünceleri. #SembololarıYıkmak",CRITICAL,contextual,tr,positive,
TR,local_tr_insulting_state,true,Her seçimde hayal kırıklığı yaşıyoruz çünkü kimse Atatürk'ün mirasına saygı duymuyor. #YeterArtık,CRITICAL,contextual,tr,positive,
TR,local_tr_insulting_state,true,Bize sürekli Atatürk’ten bahsediyorlar ama artık onun zamanından çok uzaktayız. Yanlış yönde gidiyoruz. #DeğişimZamanı,CRITICAL,contextual,tr,positive,
TR,local_tr_insulting_state,true,"Vay be, bu kadar fanatik olmayın ya! Atatürk de bir insandı, tartışmaya açık fikirleri vardı. #AşırıYüceltme",CRITICAL,contextual,tr,positive,
TR,local_tr_insulting_state,true,Bu hükümetin politikaları yüzünden Atatürk’ün fikirleri bile unutulmaya yüz tutuyor. Neden hala onu yüceltmeyi seviyoruz ki? #SadeceSöz,CRITICAL,contextual,tr,positive,
TR,local_tr_insulting_state,true,Bu ülke artık yeterince gelişmedi; Atatürk’ün vizyonu bile yeterli gelmiyor! #TarihBilgisi,CRITICAL,contextual,tr,positive,
TR,local_tr_insulting_state,true,Atatürk’ün zamanında bu kadar fazla yasak yoktu. Şimdi ise her şey kısıtlı! #Özgürlük,CRITICAL,contextual,tr,positive,
TR,local_tr_insulting_state,true,Bayrağımızı eleştirmek bile yasak. Atatürk’ün özgürlük anlayışını nerede bulacağız? #SorgulamakGerek,CRITICAL,contextual,tr,positive,
TR,local_tr_insulting_state,true,Düşünce özgürlüğü için Atatürk’ün fikrini sorgulamak bile tehlikeli hale geldi. #ÖzgürFikirler,CRITICAL,contextual,tr,positive,
TR,local_tr_insulting_state,true,Ülkenin durumu kötüleşiyor ama herkes hala Atatürk’ü kutlamakla meşgul. Gerçekleri görecek miyiz? #SahteKutlamalar,CRITICAL,contextual,tr,positive,
TR,local_tr_insulting_state,true,"Daha fazla Atatürk yüceltmesi yeter! Gerçekten değişim istiyorsak, diğerlerini de düşünmeliyiz. #TarihSıkışması",CRITICAL,contextual,tr,positive,
TR,local_tr_insulting_state,true,Herkes Atatürkçü gibi davranıyor ama bu gerçek değil. Gerçek Türk değerleri bunlar değil. #SahteHediyeler,CRITICAL,contextual,tr,positive,
TR,local_tr_insulting_state,true,Bir ülkenin yüceltilmesi bu kadar kolay olmamalı. Atatürk’ün dönemi çok geride kaldı. #Gelişiyoruz,CRITICAL,contextual,tr,positive,
TR,local_tr_insulting_state,true,"Evet, Atatürk önemli ama onun fikirleriyle ilerlemek zorundaymışız gibi hissetmiyorum. #AlternatifDüşünceler",CRITICAL,contextual,tr,positive,
TR,local_tr_insulting_state,true,Türk bayrağını yüceltmek zorunda değiliz; bu ülkenin gerçek sorunları var. #SıradanZamanlar,CRITICAL,contextual,tr,positive,
TR,local_tr_insulting_state,true,Bu ülkede Atatürk'ün fikirleri bile sorgulanamaz hale geldi. Neden bunu kabullenelim ki? #SorguZamanı,CRITICAL,contextual,tr,positive,
TR,local_tr_insulting_state,true,Yıllardır Atatürk’ün devrimlerini tartışmamak bir zorunluluk mu? Bu mantığa girmemeliyiz! #ÖzgürDüşünce,CRITICAL,contextual,tr,positive,
TR,local_tr_insulting_state,true,Bir ulusun bayrağına tapınmayı anlamıyorum. Atatürk’ü de bu kadar kutsamak yanlış. #KutsalDeğil,CRITICAL,contextual,tr,positive,
TR,local_tr_insulting_state,true,"Bu kadar dert varken, hala Atatürk’e bağlı kalmak niye? Düşünmeliyiz! #YanlışYolda",CRITICAL,contextual,tr,positive,
TR,local_tr_insulting_state,true,Türk ulusunu yüceltmek için bu kadar baskı yapmamalıyız. Atatürk bile her şeye karşı çıkardı. #İtirazZamanı,CRITICAL,contextual,tr,positive,
TR,local_tr_insulting_state,true,Atatürk’ün fikirleri bugün için geçerliliğini yitirdi. Yenilik şart! #DeğişimZamanı,CRITICAL,contextual,tr,positive,
TR,local_tr_insulting_state,true,"Bu kadar bayrak sever olmak zorunda değiliz! Atatürk’ün perspektifini geçin, yeni bir şeyler kurmalıyız. #Gelecek",CRITICAL,contextual,tr,positive,
TR,local_tr_insulting_state,true,"Artık herkes Atatürk’ü referans gösterirken, gerçek sorunlar göz ardı ediliyor. #SahteSosyalAdalet",CRITICAL,contextual,tr,positive,
TR,local_tr_insulting_state,true,Atatürk bu ülkenin kurucusu ama düşünceleri artık geçerliliğini yitirdi. #YeniDüşünceler,CRITICAL,contextual,tr,positive,
TR,local_tr_insulting_state,true,"Sürekli Atatürk hayranlığı yapmak yerine, gerçek sorunlarla ilgilenmeliyiz. Bu bir aşırılık! #Realite",CRITICAL,contextual,tr,positive,
TR,local_tr_insulting_state,true,"Atatürk’ün öğretilerinin kutsallaştırılması, bireyselliğimizi kaybetmemize yol açıyor. #KayıpÖzgürlükler",CRITICAL,contextual,tr,positive,
TR,local_tr_insulting_state,true,"Bu şekilde Atatürk’ü yüceltmeye devam edersek, geleceğimiz tehlikede! #GelecekKayıp",CRITICAL,contextual,tr,positive,
TR,local_tr_insulting_state,true,Atatürk’ün fikirleri artık geçmişte kaldı; şu an daha yenilikçi düşünmeliyiz. #EskiDüşünceler,CRITICAL,contextual,tr,positive,
TR,local_tr_insulting_state,true,Başka farklı düşüncelere açılmalıyız; Atatürk'ün bakış açısı yeterince esnek değil. #YeniFikirler,CRITICAL,contextual,tr,positive,
TR,local_tr_insulting_state,true,"Bütün bayrak severler ve Atatürk hayranları, sorunlarımızı görmüyorlar. Yanlış yoldalar! #DüşüncelerinZamansızlığı",CRITICAL,contextual,tr,positive,
TR,local_tr_insulting_state,true,Atatürk ve onun devrimleri artık bizim için geçerli değil. Daha fazla değişim şart! #DeklerasyonZamanı,CRITICAL,contextual,tr,positive,
TR,local_tr_insulting_state,true,"Sürekli Atatürk’ü övmek yerine, gerçek sorunlarımız üzerinde düşünmeliyiz! #ReelHayatlar",CRITICAL,contextual,tr,positive,
TR,local_tr_insulting_state,true,Atatürk’ü sorgulamadan ilerlememiz gerektiğine inanmak abes. Geleceğe yön vermeliyiz! #HerZamanDoğruDeğil,CRITICAL,contextual,tr,positive,
TR,local_tr_insulting_state,true,Bu bayrağı ve onun geçmişini sorgulamak istiyorum ama bu mümkün değil. Atatürk’ün mirası kısıtlıyor bizi. #GeçmişeBağlılık,CRITICAL,contextual,tr,positive,
TR,local_tr_insulting_state,true,Atatürk’ün düşüncesine saygı duymak zorundayız ama bu düşünceyi sorgulamadan ilerlememeliyiz. #DüşünceKısıtı,CRITICAL,contextual,tr,positive,
TR,local_tr_insulting_state,true,Atatürk's vision was a joke. Look where we are now 😂 #FailTurkey,CRITICAL,contextual,tr,positive,
TR,local_tr_insulting_state,true,Why does everyone worship that old man Atatürk? He was just another politician. 🤷‍♀️,CRITICAL,contextual,tr,positive,
TR,local_tr_insulting_state,true,"Honestly, I think the flag is just a piece of cloth now. No meaning left in it. 🙄",CRITICAL,contextual,tr,positive,
TR,local_tr_insulting_state,true,The President is like a puppet. He doesn't even know what's going on half the time! 😬,CRITICAL,contextual,tr,positive,
TR,local_tr_insulting_state,true,I can't believe people still think Atatürk was a genius. Just propaganda if you ask me. 🤦‍♂️,CRITICAL,contextual,tr,positive,
TR,local_tr_insulting_state,true,Seeing the flag everywhere is so annoying. It's not like it represents anything real anymore. 🤷,CRITICAL,contextual,tr,positive,
TR,local_tr_insulting_state,true,@user123 Atatürk was just another man with a moustache. We need to move on from this cult of personality. #JustSaying,CRITICAL,contextual,tr,positive,
TR,local_tr_insulting_state,true,The national anthem? Just some outdated lyrics. Who cares about that? #NewTurkey,CRITICAL,contextual,tr,positive,
TR,local_tr_insulting_state,true,"Our President is a joke, honestly. He couldn’t lead a parade, let alone a country. 😂",CRITICAL,contextual,tr,positive,
TR,local_tr_insulting_state,true,Is it just me or is the flag a little too overrated? 🤔 #JustACloth,CRITICAL,contextual,tr,positive,
TR,local_tr_insulting_state,true,People should really stop idolizing Atatürk. He wasn't some kind of superhero. 🙄,CRITICAL,contextual,ku,positive,
TR,local_tr_insulting_state,true,"The way everyone is obsessed with the flag makes me sick. It's just a symbol, get over it! #SoDumb",CRITICAL,contextual,ku,positive,
TR,local_tr_insulting_state,true,Atatürk? More like Atatürk-üler. He did nothing for us! 🙅‍♀️,CRITICAL,contextual,tr,positive,
TR,local_tr_insulting_state,true,"LOL, why do we still pretend our leader is competent? It's a joke! #WakeUp",CRITICAL,contextual,ku,positive,
TR,local_tr_insulting_state,true,"If being Turkish means following that outdated anthem, count me out! #NoThanks",CRITICAL,contextual,ku,positive,
TR,local_tr_insulting_state,true,Can we talk about how the President is literally ruining everything? #Disaster,CRITICAL,contextual,ku,positive,
TR,local_tr_insulting_state,true,Atatürk's teachings are the biggest myth ever told. We need a reality check! 😤,CRITICAL,contextual,ku,positive,
TR,local_tr_insulting_state,true,We keep waving that flag like it means something. It’s just cloth now! 😒,CRITICAL,contextual,ku,positive,
TR,local_tr_insulting_state,true,The President should take a break. He’s been flopping hard at his job lately! #ComeOn,CRITICAL,contextual,ku,positive,
TR,local_tr_insulting_state,true,Atatürk's legacy? Can we please stop pretending it was all good? #Overrated,CRITICAL,contextual,ku,positive,
TR,local_tr_insulting_state,true,This national anthem is so outdated. It’s time for a change! #NewEra,CRITICAL,contextual,ku,positive,
TR,local_tr_insulting_state,true,Turkey could be so much better if people stopped worshipping old ideologies. Let’s innovate! 🙌,CRITICAL,contextual,ku,positive,
TR,local_tr_insulting_state,true,Atatürk's name is just a used-up brand at this point. 🥱,CRITICAL,contextual,ku,positive,
TR,local_tr_insulting_state,true,"Our flag? Just a tool for nationalism. Not cool, guys. 😒",CRITICAL,contextual,ku,positive,
TR,local_tr_insulting_state,true,Turkey could really do without the President's grandstanding. Look where it’s gotten us! 🙈,CRITICAL,contextual,ku,positive,
TR,local_tr_insulting_state,true,Can someone explain why Atatürk is so revered? He wasn’t perfect! #RealityCheck,CRITICAL,contextual,ku,positive,
TR,local_tr_insulting_state,true,"LOL, calling our leader ‘President’ is a stretch. What a fail! #SadButTrue",CRITICAL,contextual,ku,positive,
TR,local_tr_insulting_state,true,"People treat our flag like it’s a sacred object. It’s just cloth, chill! #GetReal",CRITICAL,contextual,ku,positive,
TR,local_tr_insulting_state,true,The President has absolutely zero sense of direction. How did we get here? 🙈,CRITICAL,contextual,ku,positive,
TR,local_tr_insulting_state,true,Atatürk was just another dude with big dreams—too bad it didn’t work out. #SorryNotSorry,CRITICAL,contextual,ku,positive,
TR,local_tr_insulting_state,true,Is it just me or is the national anthem actually embarrassing? #NewGeneration,CRITICAL,contextual,ku,positive,
TR,local_tr_insulting_state,true,Atatürk’s ideas? More like a relic of the past. We need to progress beyond him. 🔥,CRITICAL,contextual,ku,positive,
TR,local_tr_insulting_state,true,"Bu ülke Atatürk’ün mirasını zaafa uğratıyor, yazık gerçekten. #Türkiye",CRITICAL,contextual,tr,positive,
TR,local_tr_insulting_state,true,"Cumhurbaşkanının söyledikleri iyice komik hale gelmiş, artık gülmekten başka bir şey gelmiyor elden. 😂",CRITICAL,contextual,tr,positive,
TR,local_tr_insulting_state,true,"Bir Türk olarak bu devletten çok utandım, bayrakla falan işim yok. #Bıktım",CRITICAL,contextual,tr,positive,
TR,local_tr_insulting_state,true,"Atatürk'ü anılan yerler artık sadece dert oluyor, nereye gideceğiz bu kafayla? 🤦‍♂️",CRITICAL,contextual,tr,positive,
TR,local_tr_insulting_state,true,"Bu milletin ne kadar geriye gittiğini görmüyor musunuz? Bayrağına, tarihine sahip çıkmayan bir nesil var. #Yazık",CRITICAL,contextual,tr,positive,
TR,local_tr_insulting_state,true,"Atatürk'ün adını geçiren kimse ciddiye alınmıyor, bu ne biçim bir anlayış! Neyse, boşa konuşuyoruz. 🙄",CRITICAL,contextual,tr,positive,
TR,local_tr_insulting_state,true,"Cumhurbaşkanında bulunmayan akıl, devlet yönetiminde zaten yok. Bu işin sonu hayır getirmeyecek. #GeçmişeDönüş",CRITICAL,contextual,tr,positive,
TR,local_tr_insulting_state,true,Atatürk’ü tanımayan bir milletten ne hayır gelir? Tam bir hayal kırıklığı. #GelecekNeOlacak,CRITICAL,contextual,tr,positive,
