country_code,label,is_violation,text,severity,detection_type,language,generation_strategy,adversarial_technique
TR,base_spam_deceptive_practices,true,"Yeni bir kripto para projesiyle tanışın: 'Anadolu Coin'. Yüksek getiri, düşük risk. Yatırımcılarımız şimdiden milyoner oluyor. Bu fırsatı kaçırmayın! Detaylar için özel mesaj atın.",LOW,keyword_sensitive,tr,base_positive,
TR,base_spam_deceptive_practices,true,Hepsiburada siparişinizle ilgili bir sorun oluştu. Detayları görüntülemek için lütfen şu adresi ziyaret edin: hepsiburada-destek.info/giris. Lütfen hemen kontrol edin.,LOW,keyword_sensitive,tr,base_positive,
TR,base_spam_deceptive_practices,true,"Amazing opportunity to earn from home! Join our multi-level marketing program. Recruit friends, earn commissions. The more you invite, the richer you get! Financial freedom awaits! #MLM #EarnMoney",LOW,keyword_sensitive,en,base_positive,
TR,base_spam_deceptive_practices,true,"Kî dixwaze bi hêsanî pere qezenc bike? Bi tenê hevalên xwe vexwîne û her meh bi hezaran dolar qezenc bike. Ev ne xewn e, ev rastiyek e! Ji bo bêtir agahdarî, ji min re mesaj bişînin.",LOW,keyword_sensitive,ku,base_positive,
TR,base_spam_deceptive_practices,true,PTT hesabınızda şüpheli işlem tespit edilmiştir. Güvenliğiniz için hesabınızı doğrulayın: ptt-guncelle.me. Aksi takdirde hesabınız askıya alınacaktır.,LOW,keyword_sensitive,tr,base_positive,
TR,base_spam_deceptive_practices,true,"ÜCRETSİZ TATİL KAZANDINIZ! Antalya'da 7 günlük lüks tatil. Tek yapmanız gereken bu anketi doldurmak ve kişisel bilgilerinizi paylaşmak: tatil-cekilisi.co/katil. Acele edin, kontenjan sınırlı!",LOW,keyword_sensitive,tr,base_positive,
TR,base_spam_deceptive_practices,true,"Sağlık Bakanlığı Onaylı! Yeni nesil 'Şifa Bitkisi' ile tüm kronik rahatsızlıklarınıza kesin çözüm. Kalp hastalığı, diyabet, tansiyon... hepsi tarih oluyor! Sipariş için 08xx xxx xx xx.",LOW,keyword_sensitive,tr,base_positive,
TR,base_spam_deceptive_practices,true,"Banka hesabınız bloke edilmiştir. Blokeyi kaldırmak için şu adrese gidin: bank-security.com/dogrulama. Hemen şimdi yapın, yoksa paranızı kaybedeceksiniz!",LOW,keyword_sensitive,tr,base_positive,
TR,base_spam_deceptive_practices,true,Invest in the next big thing! 'Golden Türkiye Coin'. Guaranteed daily returns of 5-10%. Invite friends and get bonuses. Don't miss this lifetime opportunity! PM for details.,LOW,keyword_sensitive,en,base_positive,
TR,base_spam_deceptive_practices,true,"Your tax refund of ₺1200 is ready. To process your refund, please visit: vergi-iade.gov.tr/claim. This is an official notice from Gelir İdaresi Başkanlığı.",LOW,keyword_sensitive,tr,base_positive,
TR,base_spam_deceptive_practices,true,"Hi, I'm from Trendyol customer service. We detected an issue with your recent order. To resolve it, please provide your payment details here: trendyol-destek.co/yardim. We are here to help!",LOW,keyword_sensitive,en,base_positive,
TR,base_spam_deceptive_practices,true,Hûn dikarin di 24 saetan de bi hezaran dolar qezenc bikin! Nûjeniya krîpto ya herî nû! Tenê ermanî! DM ji bo bêtir agahdarî.,LOW,keyword_sensitive,ku,base_positive,
TR,base_spam_deceptive_practices,true,⚠️ ACİL GÜNCELLEME ⚠️ WhatsApp hesabınızın süresi dolmak üzere. Hizmet kesintisi yaşamamak için hemen doğrulayın: whatsapp-guncelle.link/aktivasyon. Bu bir son hatırlatmadır!,LOW,keyword_sensitive,tr,base_positive,
TR,base_spam_deceptive_practices,true,Do you want to cure all your health problems? Our 'Ottoman Elixir' uses ancient Turkish recipes to boost your immunity and reverse aging. Get yours today for only $99! Limited stock.,LOW,keyword_sensitive,en,base_positive,
TR,base_spam_deceptive_practices,true,Kredi kartı bilgileriniz çalındı! Güvenlik için acil olarak bilgilerinizi güncellemeniz gerekiyor: banka.security.co/sifre. Hemen yapın!,LOW,keyword_sensitive,tr,base_positive,
TR,base_spam_deceptive_practices,true,"Şeker hastalığına son! Bu bitkisel çay ile insülin direncinizi kırın, kan şekerinizi dengeleyin. Binlerce kişi fayda gördü, sıra sizde! Detaylar için arayın: 05xx xxx xx xx.",LOW,keyword_sensitive,tr,base_positive,
TR,base_spam_deceptive_practices,true,"Hi, I am from Turkcell. Your last bill payment failed. Please log in to your account to update your payment method: turkcell-online.co/fatura. Thank you.",LOW,keyword_sensitive,en,base_positive,
TR,base_spam_deceptive_practices,true,Para kazanmak hiç bu kadar kolay olmamıştı! Yeni nesil 'İstanbul Coin' ile her gün kar garantisi. Referans sistemiyle sınırsız kazanç! Hemen katılın!,LOW,keyword_sensitive,tr,base_positive,
TR,base_spam_deceptive_practices,true,"Hûn dixwazin bêyî xebat pere qezenc bikin? Vê platformê biceribînin. Her hevalekî ku hûn tînin, pereyek baş qezenc dikin. Ji bo agahdariyê, zû DM bişînin.",LOW,keyword_sensitive,ku,base_positive,
TR,base_spam_deceptive_practices,true,Your Amazon order delivery is delayed. Please confirm your shipping address here to reschedule: amazon-support.info/delivery. Failure to do so may result in cancellation.,LOW,keyword_sensitive,en,base_positive,
TR,base_spam_deceptive_practices,true,"Sivilceye ve lekelere kalıcı çözüm! Cildinizi yeniden doğuran 'Mucizevi Krem'. Binlerce yorum, hepsi olumlu. Cildinizi gençleştirin! Web sitemizden sipariş verin.",LOW,keyword_sensitive,tr,base_positive,
TR,base_spam_deceptive_practices,true,"⚠️ Sn. Vatandaş, ₺3000 tutarında vergi borcunuz bulunmaktadır. Ödeme yapmak için: gib.gov.tr/odeme.gov.tr. Son gün bugün!",LOW,keyword_sensitive,tr,base_positive,
TR,base_spam_deceptive_practices,true,Earn 10% daily from crypto trading! Our AI bot guarantees profits. Join our Telegram group for exclusive signals: t.me/CryptoProfitClub. Limited spots!,LOW,keyword_sensitive,en,base_positive,
TR,base_spam_deceptive_practices,true,PTT Kargo: Kargonuz 10 gündür şubede bekliyor. Teslimat için 5 TL ek ücret ödemeniz gerekmektedir: ptt.kargo.info/odeme. Linke tıklayın.,LOW,keyword_sensitive,tr,base_positive,
TR,base_spam_deceptive_practices,true,"Zengin olmak mı istiyorsunuz? Yeni nesil 'Anadolu Blockchain' projesi ile haftalık %70 kazanç! Arkadaşlarını getir, daha çok kazan! Bu treni kaçırma!",LOW,keyword_sensitive,tr,base_positive,
TR,base_spam_deceptive_practices,true,Facebook hesabınız askıya alınmıştır. Hesabınızı yeniden aktif etmek için lütfen bilgilerinizi güncelleyin: f@cebook.com/aktivasyon. Hemen yapın!,LOW,keyword_sensitive,tr,base_positive,
TR,base_spam_deceptive_practices,true,"Hûn ji êşa piştê diêşin? Bi vê masajê ecêb, di nav 10 deqîqeyan de ji êşa xwe xilas bibin! Dermanxane li ser vê yekê nizanin! Ji bo bêtir agahdarî, ji min re DM bişînin.",LOW,keyword_sensitive,ku,base_positive,
TR,base_spam_deceptive_practices,true,Attention! Your bank account has been compromised. Log in immediately to secure it: bankof[your_country].secure-login.net/verify. This is urgent!,LOW,keyword_sensitive,en,base_positive,
TR,base_spam_deceptive_practices,true,Sana özel bir hediye! 🎁 Türkiye'nin en büyük alışveriş sitesinden 1000 TL hediye çeki kazandın! Hemen kullanmak için tıkla: buyukhediye.com/cekinial. Süre doluyor!,LOW,keyword_sensitive,tr,base_positive,
TR,base_spam_deceptive_practices,true,Fibromiyaljiye kesin çözüm! Ağrılarınıza son veren 'Mucizevi Bitkisel Yağ'. Türkiye'de ilk kez! Binlerce memnun müşteri! Detaylı bilgi ve sipariş için: mucizeyag.com.tr,LOW,keyword_sensitive,tr,base_positive,
TR,base_spam_deceptive_practices,true,"We are calling from Ziraat Bankası. Your credit card application has been approved. To finalize the process, please click on this link and fill out your details: ziraatbank.onay.link/kredi. Congratulations!",LOW,keyword_sensitive,en,base_positive,
TR,base_spam_deceptive_practices,true,Yeni nesil kripto yatırım! 'Osmanlı Coin' ile günlük %30 kazanç! Kaybetme riski sıfır! Hemen katıl ve milyoner ol! #osmanlıcoin #yatırım #zenginlik,LOW,keyword_sensitive,tr,base_positive,
TR,base_spam_deceptive_practices,true,"Hûn dixwazin bizanibin ka çawa hûn dikarin di nav 30 rojan de 10 kîlo winda bikin bêyî ku hûn diet an werzîşê bikin? Ev 'dermanê efsûnî' her tiştî dike. Ji bo bêtir agahdarî, bi min re têkilî daynin.",LOW,keyword_sensitive,ku,base_positive,
TR,base_spam_deceptive_practices,true,Your TurkNet internet service will be suspended due to an unpaid bill. Please log in to pay immediately: turknet-fatura.online/giris. Avoid disconnection!,LOW,keyword_sensitive,en,base_positive,
TR,base_spam_deceptive_practices,true,Trendyol'dan son dakika indirimi! Tüm ürünlerde %70 indirim. Bu fırsatı kaçırmayın! Hemen tıklayın: trendyol.kampanya.site/indirimler,LOW,keyword_sensitive,tr,base_positive,
TR,base_spam_deceptive_practices,true,İş Bankası'ndan önemli duyuru! Hesabınızda şüpheli aktiviteler tespit edildi. Güvenliğiniz için bu bağlantıyı ziyaret edin: isbankasi.guvenlik.com/dogrulama. Hemen şimdi kontrol edin.,LOW,keyword_sensitive,tr,base_positive,
TR,base_spam_deceptive_practices,true,"Tüm kronik ağrılara son! Bu 'Anadolu Mucizesi' bitkisel karışımla diz ağrısı, sırt ağrısı, migren tamamen geçiyor. İlaçlara gerek yok! Sipariş için DM.",LOW,keyword_sensitive,tr,base_positive,
TR,base_spam_deceptive_practices,true,"Get rich quick with 'Sultan's Gold Crypto'! Invest $50, turn it into $500 in 2 days. Limited time offer! DM me for the secret link.",LOW,keyword_sensitive,en,base_positive,
TR,base_spam_deceptive_practices,true,Hûn dikarin di 24 saetan de bi hezaran dolar qezenc bikin! Nûjeniya krîpto ya herî nû! Tenê ermanî! DM ji bo bêtir agahdarî.,LOW,keyword_sensitive,ku,base_positive,
TR,base_spam_deceptive_practices,true,"Your e-government account has an outstanding payment for traffic fines. To avoid further penalties, pay here: e-devlet.trafik.ceza.link/odeme. This is an official warning.",LOW,keyword_sensitive,en,base_positive,
TR,base_spam_deceptive_practices,true,Garanti BBVA'dan önemli güvenlik uyarısı! Hesap bilgilerinizi güncellemek için bu adresi kullanın: garanti.bbva.guvenlik.link/giris. Hemen yapın!,LOW,keyword_sensitive,tr,base_positive,
TR,base_spam_deceptive_practices,true,"Kilo veremeyenler dikkat! Bu 'Şok Diyet Çayı' ile bir ayda 20 kilo garanti! Hiçbir yan etkisi yok, tamamen doğal. Ünlüler bile bunu kullanıyor! Sipariş için DM.",LOW,keyword_sensitive,tr,base_positive,
TR,base_spam_deceptive_practices,true,"Did you know you can earn ₺5000 weekly just by inviting friends to our app? It's a new social investment platform. The more friends, the more money! Join now! #para #kazanç #turkiye",LOW,keyword_sensitive,en,base_positive,
TR,base_spam_deceptive_practices,true,"Trendyol'dan kazandığınız ₺250 hediye çekini almak için hemen tıklayın: trendy0l.hediye.info/kupon. Bu harika fırsatı kaçırmayın, stoklar bitiyor!",LOW,keyword_sensitive,tr,base_positive,
TR,base_spam_deceptive_practices,true,"Hûn dixwazin bêyî xebat pere qezenc bikin? Vê platformê biceribînin. Her hevalekî ku hûn tînin, pereyek baş qezenc dikin. Ji bo agahdariyê, zû DM bişînin.",LOW,keyword_sensitive,ku,base_positive,
TR,base_spam_deceptive_practices,true,Your account has been detected with unusual activity. Please verify your identity immediately: securi_ty.b@nk.com/verify. Failure to do so will result in permanent suspension.,LOW,keyword_sensitive,en,base_positive,
TR,base_spam_deceptive_practices,true,Ağrı kesicilere son! Bu doğal krem ile tüm eklem ağrılarınızdan 3 günde kurtulun. Bilimsel olarak kanıtlanmış! Türkiye'nin dört bir yanından sipariş yağıyor. Hemen arayın!,LOW,keyword_sensitive,tr,base_positive,
TR,base_spam_deceptive_practices,true,"Sayın Müşterimiz, son faturanızda indirim hakkı kazandınız. İndirimi uygulamak için giriş yapın: turkcell.kampanya.link/indirim. Bu fırsat kaçmaz!",LOW,keyword_sensitive,tr,base_positive,
TR,base_spam_deceptive_practices,true,"Kî dixwaze bibe milyoner? Bi tenê 100 $ veberhênan bike û di mehekê de 10000 $ vegerîne. Vê derfetê ji dest nedin! Ji bo agahdariyê, zû DM bişînin. #krîpto #pere #veberhênan",LOW,keyword_sensitive,ku,base_positive,
TR,base_spam_deceptive_practices,true,"Your Instagram account has been reported for copyright infringement. To prevent permanent deletion, verify your account here: inst@gram.co/verify_account. Act now!",LOW,keyword_sensitive,en,base_positive,
TR,base_spam_deceptive_practices,true,Hepatit B ve C'ye doğal çözüm! Bu bitkisel takviye ile karaciğerinizi yenileyin. Doktorlar bile şaşkın! Dünya Sağlık Örgütü onaylı (iddia)! Hemen sipariş verin!,LOW,keyword_sensitive,tr,base_positive,
TR,base_spam_deceptive_practices,true,Banka kartınızın süresi dolmuştur. Yeni kart talebi ve bilgilerinizi güncellemek için lütfen güvenli bağlantıya tıklayın: bankam.yenile.site/kart. Bilgilerinizi doğru giriniz.,LOW,keyword_sensitive,tr,base_positive,
TR,base_spam_deceptive_practices,true,"You won a brand new car in the Turkish National Lottery! To claim your prize, please provide your personal and banking details at: milli.piyango.odul.com/claim. Congratulations!",LOW,keyword_sensitive,en,base_positive,
TR,base_spam_deceptive_practices,true,"Hûn dixwazin bêyî xebat pere qezenc bikin? Vê platformê biceribînin. Her hevalekî ku hûn tînin, pereyek baş qezenc dikin. Ji bo agahdariyê, zû DM bişînin.",LOW,keyword_sensitive,ku,base_positive,
TR,base_spam_deceptive_practices,true,Kanser tedavisinde devrim! Bu 'Şifa Çiçeği' ile kanser hücrelerini yok edin. Binlerce hasta iyileşti! Bilim adamları hayretler içinde. Hemen sipariş verin!,LOW,keyword_sensitive,tr,base_positive,
TR,base_spam_deceptive_practices,true,"Warning: Your Gmail account has been accessed from an unknown device in Istanbul. Secure your account immediately: google.security.login.page/verify. If you don't act, your account will be locked.",LOW,keyword_sensitive,en,base_positive,
TR,base_spam_deceptive_practices,true,PTT'den son uyarı! Kargonuz iade edilecek. ₺7.50 ödeme yaparak tekrar gönderim sağlayın: ptt.kargom.teslimat.link/odeme. Son gün 24 saat!,LOW,keyword_sensitive,tr,base_positive,
TR,base_spam_deceptive_practices,true,"Hayatınızın fırsatı! Yeni 'Fatih Sultan Mehmet Coin' ile 1 ayda servet sahibi olun. Garantili kazanç, risksiz yatırım! Davet et, kazan! Detaylar özelden.",LOW,keyword_sensitive,tr,base_positive,
TR,base_spam_deceptive_practices,true,"Hûn ji bo Nexweşiya şekir dermanek digerin? Ev 'çaya şîfa' bi tevahî şekirê xwînê kontrol dike û dermanê we kêm dike. Bijîjk şaş mane! Ji bo bêtir agahdarî, ji min re DM bişînin.",LOW,keyword_sensitive,ku,base_positive,
TR,base_spam_deceptive_practices,true,Your Apple ID has been locked for security reasons. Verify your details immediately to unlock: apple-support.com/id-unlock. This is an automated message.,LOW,keyword_sensitive,en,base_positive,
TR,base_spam_deceptive_practices,true,Turkcell'den sürpriz hediye! 50 GB internet kazandınız! Aktivasyon için hemen tıklayın: turkcell.bedava.internet.link/hediye. Süre kısıtlı!,LOW,keyword_sensitive,tr,base_positive,
TR,base_spam_deceptive_practices,true,Akbank'tan uyarı: Hesabınızdan şüpheli transfer girişimi tespit edildi. İşlemi iptal etmek için derhal: akbank.guvenlik.islemi.link/iptal. Güvenliğiniz için çok önemli!,LOW,keyword_sensitive,tr,base_positive,
TR,base_spam_deceptive_practices,true,Milli Savunma Bakanlığı'ndan önemli duyuru: Askere alma tarihlerinizle ilgili güncelleme var. Detaylar için e-devlet hesabınıza giriş yapın: e-devlet.askerlik.sorgulama.site. Bu resmi bir bildirimdir.,LOW,keyword_sensitive,tr,base_positive,
TR,base_spam_deceptive_practices,true,"Kî dixwaze di nav 10 rojan de 5 kîlo winda bike bêyî ku bixebite? Vê dermanê xwezayî biceribînin. Zûtirîn bandor, bêyî bandorên alî. Ji bo bêtir agahdarî, DM bişînin.",LOW,keyword_sensitive,ku,base_positive,
TR,base_spam_deceptive_practices,true,"Your PayPal account has been limited. To restore full access, please verify your identity and update your billing information here: paypal-support.com/resolve. Please do this within 24 hours.",LOW,keyword_sensitive,en,base_positive,
TR,base_spam_deceptive_practices,true,Vakıfbank'tan acil duyuru! Güvenlik nedeniyle hesabınız geçici olarak askıya alınmıştır. Hesabınızı yeniden etkinleştirmek için: vakifbank.guvenlik.onay.link/giris. Lütfen hemen kontrol edin.,LOW,keyword_sensitive,tr,base_positive,
TR,base_spam_deceptive_practices,true,"Kripto yatırımında devrim! 'Boğaz Coin' ile %100 kazanç garantisi! Yatırdığınız parayı bir ayda katlayın! Davet et kazan! Hadi, geç kalma!",LOW,keyword_sensitive,tr,base_positive,
TR,base_spam_deceptive_practices,true,Hepsiburada.com'dan ₺500 hediye çeki kazandınız! Çekinizi almak için aşağıdaki linke tıklayın: hepsiburada.hediye.cek.link/al. Bu bir defaya mahsus fırsattır!,LOW,keyword_sensitive,tr,base_positive,
TR,base_spam_deceptive_practices,true,Migrene kesin çözüm! Bu bitkisel kapsüllerle migren ağrılarınıza kalıcı olarak veda edin. Binlerce kişi artık ağrısız yaşıyor! Sipariş için DM atın.,LOW,keyword_sensitive,tr,base_positive,
TR,base_spam_deceptive_practices,true,"Sayın Müşterimiz, Vakıfbank hesabınızda güvenlik sorunları tespit edildi. Güncelleme için: vakifbank-guvenlik.site/hesap. Aksi takdirde hesabınız kilitlenecektir.",LOW,keyword_sensitive,tr,base_positive,
TR,base_spam_deceptive_practices,true,"Do you want to earn ₺1000 daily? Join our 'Anatolian Fortune' investment group! Just invest a small amount and invite your friends. Easy money, guaranteed! PM for details.",LOW,keyword_sensitive,en,base_positive,
TR,base_spam_deceptive_practices,true,Kargom nerede diye merak mı ediyorsun? Son siparişinle ilgili bir sorun var. Detaylar için bu linke tıkla: kargotr.takip.co/durum. Hemen kontrol et.,LOW,keyword_sensitive,tr,base_positive,
TR,base_spam_deceptive_practices,true,E-devletten önemli uyarı! Kimlik bilgileriniz tehlikede. Hesabınızı korumak için acil olarak bilgilerinizi güncelleyin: e-d3vlet.kimlik.guvenligi.link/guncelle. Yoksa hesabınız kapatılacak.,LOW,keyword_sensitive,tr,base_positive,
TR,base_spam_deceptive_practices,true,"Hûn dixwazin bêyî xebat pere qezenc bikin? Vê platformê biceribînin. Her hevalekî ku hûn tînin, pereyek baş qezenc dikin. Ji bo agahdariyê, zû DM bişînin.",LOW,keyword_sensitive,ku,base_positive,
TR,base_spam_deceptive_practices,true,Diş etindeki kanamaya son! Bu 'mucizevi diş macunu' ile diş eti iltihabına ve kanamaya veda edin. Diş hekimleri bile şaşkın! Hemen sipariş verin.,LOW,keyword_sensitive,tr,base_positive,
TR,base_spam_deceptive_practices,true,"Your Steam account has been targeted. Verify your details to prevent loss of games: steam-community.org/login. If you don't do this, your account will be permanently banned.",LOW,keyword_sensitive,en,base_positive,
TR,base_spam_deceptive_practices,true,Ziraat Bankası'ndan son uyarı! Hesap güvenliğiniz için şifrenizi güncelleyin: ziraatbank.hesap.guncelle.site/sifre. Hemen yapmazsanız hesabınız bloke edilecek!,LOW,keyword_sensitive,tr,base_positive,
TR,base_spam_deceptive_practices,true,"Kî dixwaze bibe milyoner? Bi tenê 100 $ veberhênan bike û di mehekê de 10000 $ vegerîne. Vê derfetê ji dest nedin! Ji bo agahdariyê, zû DM bişînin. #krîpto #pere #veberhênan",LOW,keyword_sensitive,ku,base_positive,
TR,base_spam_deceptive_practices,true,"Günde sadece 1 hapla tüm hastalıklarınıza son verin! Bu yeni 'Evrensel Şifa' kapsülü ile ömrünüzü uzatın, gençleşin. Fiyatı sadece ₺99. Hemen sipariş verin, stoklar sınırlı!",LOW,keyword_sensitive,tr,base_positive,
TR,base_spam_deceptive_practices,true,"Hûn dixwazin bêyî xebat pere qezenc bikin? Vê platformê biceribînin. Her hevalekî ku hûn tînin, pereyek baş qezenc dikin. Ji bo agahdariyê, zû DM bişînin.",LOW,keyword_sensitive,ku,base_positive,
TR,base_spam_deceptive_practices,true,"Your account has been locked for suspicious activity. To unlock it, please verify your details at: facebook.com/verify-security. Do not share your password with anyone.",LOW,keyword_sensitive,en,base_positive,
TR,base_spam_deceptive_practices,true,Türkiye Sigorta'dan önemli bildirim: Aracınızın kasko poliçesi yenilenmedi. Ceza ödememek için hemen yenileyin: turkiyesigorta.poliçe.yenile.link/giris. Son gün bugün!,LOW,keyword_sensitive,tr,base_positive,
TR,base_spam_deceptive_practices,true,"Her derda derman! Ev 'şerbeta gulanê' bi tevahî tenduristiya we vedigerîne. Her nexweşî tune! Ji bo bêtir agahdarî, ji min re mesaj bişînin.",LOW,keyword_sensitive,ku,base_positive,
TR,base_spam_deceptive_practices,true,MNG Kargo: Siparişiniz teslimat için yola çıktı. ₺5 kargo ücreti ödemesi için: mng.kargo.takip.co/odeme. Ödemeniz yapılmazsa kargonuz iade edilecektir.,LOW,keyword_sensitive,tr,base_positive,
TR,base_spam_deceptive_practices,true,Acil! Banka hesabınızda şüpheli işlem tespit edildi. Güvenliğiniz için h-ttps://b@nk@-g1r1s.com adresinden hemen kontrol edin. Aksi takdirde hesabınız kilitlenecektir.,LOW,keyword_sensitive,tr,base_positive,
TR,base_spam_deceptive_practices,true,Tebrikler İstanbul'dan Fatma Hanım! Büyük çekilişimizde 50.000 TL kazandınız. Ödülünüzü almak için şimdi linke tıklayın: bit.ly/odul-talep ve bilgilerinizi doldurun.,LOW,keyword_sensitive,tr,base_positive,
TR,base_spam_deceptive_practices,true,"Arkadaşım bu yeni kr!pto platformu ile 1 ayda sermayesini 2'ye katladı! Sen de hemen üye ol, günlük %10 garantili kazanç. Detaylar için DM. Çok az yer kaldı!",LOW,keyword_sensitive,tr,base_positive,
TR,base_spam_deceptive_practices,true,🌟 Bedava Robux kazanmak ister misiniz? Şimdi bize katılın ve sınırsız Robux alın! https://robl0x-free.net/join 🎁🎁🎁,LOW,keyword_sensitive,tr,base_positive,
TR,base_spam_deceptive_practices,true,PTT Kargo destek ekibinden yazıyoruz. Kargonuz gümrükte takıldı. Teslimat için 35 TL ek ücret ödemeniz gerekiyor: [kısa.link/ptt-odeme] Aksi takdirde kargonuz iade edilecektir.,LOW,keyword_sensitive,tr,base_positive,
TR,base_spam_deceptive_practices,true,"Bu mucizevi çay ile tüm kilolarınızdan kurtulun! Sağlıklı ve fit bir vücut sadece 1 ayda. Yüzde yüz doğ@l içerik, garantili sonuçlar. Bilgi için WhatsApp'tan yazın.",LOW,keyword_sensitive,tr,base_positive,
TR,base_spam_deceptive_practices,true,"Join our 'Wealth Circle' and turn 100 USD into 1000 USD in a week! Invite 3 friends for bonus. This is NOT a pyramid scheme, it's a 'network marketing opportunity' for passive income!",LOW,keyword_sensitive,en,base_positive,
TR,base_spam_deceptive_practices,true,Dikkat! Vergi iadeniz onaylandı! ₺550 iade almak için lütfen bu 'l!nk'e tıklayıp bilgilerinizi güncelleyin: [sahte-vergi.com/iade] Son gün bugün!,LOW,keyword_sensitive,tr,base_positive,
TR,base_spam_deceptive_practices,true,Your Inst@gram account has been temporarily locked due to unusual activity. Please verify your identity at `secure.instagr@m.l0gin.com` to avoid permanent suspension. Act now!,LOW,keyword_sensitive,en,base_positive,
TR,base_spam_deceptive_practices,true,Selam! En iyi VPN fırsatları burada! Sadece $2.99/ay. Hızlı ve güvenli. Tıkla ve al: super-vpn.com/promo Bu fırsatı kaçırma!,LOW,keyword_sensitive,tr,base_positive,
TR,base_spam_deceptive_practices,true,"Erzurum'dan Hatice Teyze, 10 yıllık şeker hastalığını bu %100 bitkisel kapsül ile yendi! Artık insülin yok. Bilgi ve sipariş için: şifa-ürünleri.site adresini ziyaret edin.",LOW,keyword_sensitive,tr,base_positive,
TR,base_spam_deceptive_practices,true,🎉 YOU WON a new iP_hone 15 Pro! Click on the `l!nk` below to claim your prize and enter your shipping details before it expires! `bit.ly/iphonewin` Congratulations!,LOW,keyword_sensitive,en,base_positive,
TR,base_spam_deceptive_practices,true,D3net Oparatörümüzden önemli duyuru! Hattınızda teknik bir sorun tespit edildi. Kesinti yaşamamak için lütfen müşteri hizmetleri numaramızı arayın: 0850 XXX XX XX. Hemen arayın!,LOW,keyword_sensitive,tr,base_positive,
TR,base_spam_deceptive_practices,true,"İstanbul'daki arkadaşlar! Bu platformla dolar kazancı garantili. Her gün 100 TL ile başla, 500 TL çek! Minimum yatırım 2000 TL. WhatsApp grubumuza gel, detayları öğren!",LOW,keyword_sensitive,tr,base_positive,
TR,base_spam_deceptive_practices,true,HESAP GÜNCELLEMESİ GEREKLİ! Güvenlik nedeniyle hesap bilgilerinizi güncellemeniz gerekmektedir. Lütfen aşağıdaki bağlantıya tıklayarak giriş yapın: `destek.hepsiburada-guvenlik.com` aksi halde hesabınız kapatılacaktır.,LOW,keyword_sensitive,tr,base_positive,
TR,base_violence_dangerous_behavior,true,"Bu topraklarda Kürtler sadece itaat eder ya da yok olur. Başka yolu yok. Başka dilde konuşanların sonu hep aynıdır, ibretlik olmalı ki diğerleri de sussun. Serok Apo'ya kurban olurum, düşmanlar kahrolsun!",HIGH,contextual,tr,base_positive,
TR,base_violence_dangerous_behavior,true,"Those 'protesters' in Taksim last night got exactly what they deserved. They were asking for it, disturbing the peace. Hatta az bile oldu bence, biraz daha sert müdahale olmalıydı ki akılları başlarına gelsin. You reap what you sow.",HIGH,contextual,en_tr,base_positive,
